{
  "$schema": "../../../contrats/polymorph-native.schema.json",
  "format": 1,
  "type": "native",
  "id": "infirmary",
  "version": "1.0.0",
  "name": "Infirmerie",
  "description": "Visites à l'infirmerie : motif, soins, orientation et parent prévenu, avec une carte sur la fiche de l'apprenant.",
  "publisher": "Exemple de la documentation Polymorph",
  "compatibility": { "polymorph": "^1.0", "php": ">=8.4" },
  "dependencies": {},
  "permissions": {
    "infirmary.view": "Consulter les visites à l'infirmerie",
    "infirmary.manage": "Enregistrer et modifier les visites à l'infirmerie"
  },
  "roles": { "DIRECTION": ["infirmary.view"], "SECRETARIAT": ["infirmary.view", "infirmary.manage"] },
  "backend": { "class": "PolymorphExt\\Infirmary\\Extension" },
  "ui": { "module": "ui/index.js", "sdk": "^1.0" },
  "application": {
    "name": "Infirmerie",
    "tint": { "tile": "#fde4e4", "plate": "#e5484d", "edge": "#b8323a", "detail": "#8f1f27" },
    "pictogram": [
      { "element": "rect", "x": 32, "y": 30, "width": 46, "height": 36, "rx": 8, "color": "white" },
      { "element": "rect", "x": 50.5, "y": 36, "width": 9, "height": 24, "rx": 2, "color": "detail" },
      { "element": "rect", "x": 43, "y": 43.5, "width": 24, "height": 9, "rx": 2, "color": "detail" }
    ],
    "screens": [
      { "label": "Visites", "icon": "pi-heart", "path": "" },
      { "label": "Motifs", "icon": "pi-list", "path": "reasons", "permission": "infirmary.manage" }
    ]
  },
  "translations": {
    "en": {
      "Infirmerie": "Infirmary",
      "Visites à l'infirmerie : motif, soins, orientation et parent prévenu, avec une carte sur la fiche de l'apprenant.": "Infirmary visits: reason, care, outcome and parent informed, with a card on the learner's record.",
      "Consulter les visites à l'infirmerie": "View infirmary visits",
      "Enregistrer et modifier les visites à l'infirmerie": "Record and edit infirmary visits",
      "Visites": "Visits",
      "Motifs": "Reasons",
      "Nouvelle visite": "New visit",
      "Apprenant": "Learner",
      "Rechercher un apprenant": "Search for a learner",
      "Date et heure": "Date and time",
      "Motif": "Reason",
      "Soins donnés": "Care given",
      "Orientation": "Outcome",
      "Retour en classe": "Back to class",
      "Rentré à la maison": "Sent home",
      "Orienté vers un médecin": "Referred to a doctor",
      "Parent prévenu": "Parent informed",
      "Oui": "Yes",
      "Non": "No",
      "Enregistrer": "Save",
      "Annuler": "Cancel",
      "Supprimer": "Delete",
      "Supprimer cette visite ?": "Delete this visit?",
      "Visite enregistrée.": "Visit saved.",
      "Visite supprimée.": "Visit deleted.",
      "Aucune visite sur la période.": "No visits in this period.",
      "Aucune visite à l'infirmerie.": "No infirmary visits.",
      "Du": "From",
      "Au": "To",
      "visites": "visits",
      "visite": "visit",
      "Parent non prévenu": "Parent not informed",
      "Voir toutes les visites": "See all visits",
      "Nouveau motif": "New reason",
      "Ajouter": "Add",
      "Motif ajouté.": "Reason added.",
      "Motif retiré.": "Reason removed.",
      "Les motifs proposés à la saisie d'une visite. On peut toujours en écrire un autre.": "Reasons suggested when recording a visit. Another one can always be typed in."
    },
    "ar": {
      "Infirmerie": "العيادة المدرسية",
      "Visites à l'infirmerie : motif, soins, orientation et parent prévenu, avec une carte sur la fiche de l'apprenant.": "زيارات العيادة المدرسية: السبب والعلاج والتوجيه وإبلاغ ولي الأمر، مع بطاقة في ملف المتعلم.",
      "Consulter les visites à l'infirmerie": "الاطلاع على زيارات العيادة",
      "Enregistrer et modifier les visites à l'infirmerie": "تسجيل زيارات العيادة وتعديلها",
      "Visites": "الزيارات",
      "Motifs": "الأسباب",
      "Nouvelle visite": "زيارة جديدة",
      "Apprenant": "المتعلم",
      "Rechercher un apprenant": "ابحث عن متعلم",
      "Date et heure": "التاريخ والوقت",
      "Motif": "السبب",
      "Soins donnés": "العلاج المقدَّم",
      "Orientation": "التوجيه",
      "Retour en classe": "العودة إلى القسم",
      "Rentré à la maison": "العودة إلى المنزل",
      "Orienté vers un médecin": "التوجيه إلى طبيب",
      "Parent prévenu": "أُبلغ ولي الأمر",
      "Oui": "نعم",
      "Non": "لا",
      "Enregistrer": "حفظ",
      "Annuler": "إلغاء",
      "Supprimer": "حذف",
      "Supprimer cette visite ?": "حذف هذه الزيارة؟",
      "Visite enregistrée.": "سُجّلت الزيارة.",
      "Visite supprimée.": "حُذفت الزيارة.",
      "Aucune visite sur la période.": "لا زيارات في هذه الفترة.",
      "Aucune visite à l'infirmerie.": "لا زيارات للعيادة.",
      "Du": "من",
      "Au": "إلى",
      "visites": "زيارات",
      "visite": "زيارة",
      "Parent non prévenu": "لم يُبلَّغ ولي الأمر",
      "Voir toutes les visites": "عرض كل الزيارات",
      "Nouveau motif": "سبب جديد",
      "Ajouter": "إضافة",
      "Motif ajouté.": "أُضيف السبب.",
      "Motif retiré.": "أُزيل السبب.",
      "Les motifs proposés à la saisie d'une visite. On peut toujours en écrire un autre.": "الأسباب المقترحة عند تسجيل زيارة. يمكن دائماً كتابة سبب آخر."
    }
  }
}
